{
  "schema_version": 2,
  "id": "coda-shop",
  "name": "Quartermaster Fine",
  "room_id": "coda-threshold",
  "stock": [
    {"item_id": "health-potion"},
    {"item_id": "mana-potion"},
    {"item_id": "cure-potion"},
    {"item_id": "elixir-of-vigor"},
    {"item_id": "scroll-of-healing"},
    {"item_id": "scroll-of-recall"},
    {"item_id": "bread"},
    {"item_id": "meat"},
    {"item_id": "water"},
    {"item_id": "ale"},
    {"item_id": "torch"},
    {"item_id": "lantern"}
  ],
  "sell_ratio": 0.5
}
